{
  "schema_version": "1.0.0",
  "record_type": "finding",
  "id": "urolithin-a-obesity-vascular-registry-completed-no-results",
  "name": "Middle-aged obesity urolithin A registry is completed with no posted results",
  "summary": "NCT05921266 is a completed urolithin A registry with vascular and mitochondrial biomarker endpoints, but no posted results are available.",
  "source_id": "nct-05921266",
  "study_id": "urolithin-a-obesity-vascular-mitochondrial-registry",
  "intervention_ids": [
    "urolithin-a"
  ],
  "track_ids": [
    "microbiome-metabolite-restoration",
    "mitophagy-enhancers"
  ],
  "hallmark_ids": [
    "dysbiosis",
    "mitochondrial_dysfunction"
  ],
  "endpoint_category": "regulatory",
  "direction": "inconclusive",
  "evidence_tier": "regulatory_or_program_update",
  "confidence": "low",
  "statement": "ClinicalTrials.gov lists NCT05921266 as a completed 50-participant urolithin A trial in middle-aged adults with obesity, with arterial, cerebral blood-flow, nitric-oxide, and mitochondrial-function biomarker endpoints and no posted results in the June 10, 2026 API view.",
  "population_or_model": "Adults aged 40 to 64 years with obesity",
  "time_horizon": "28-day intervention; actual completion on 2025-05-14",
  "quantitative_note": "Actual enrollment is 50; registry status is completed; result status is not posted.",
  "caveats": [
    "No-results registry status is not efficacy evidence.",
    "The population and endpoints are metabolic and vascular rather than direct healthy-aging function.",
    "The absence of posted results limits confidence until registry results or a linked publication appears."
  ],
  "tags": [
    "human",
    "urolithin-a",
    "middle-aged-adults",
    "obesity",
    "trial-registry",
    "no-results",
    "coverage-repair"
  ]
}
