{
  "schema_version": "1.0.0",
  "record_type": "finding",
  "id": "metformin-blunted-exercise-mitochondrial-adaptations-older-adults",
  "name": "Metformin blunted some aerobic exercise adaptations in older adults",
  "summary": "An older-adult exercise trial is an important functional and mitochondrial-adaptation boundary for metformin and exercise-mimetic claims.",
  "source_id": "pmid-30548390",
  "study_id": "metformin-aerobic-exercise-older-adults",
  "intervention_ids": [
    "metformin",
    "structured-exercise-training"
  ],
  "track_ids": [
    "ampk-and-metabolic-modulators",
    "mitochondrial-biogenesis-and-dynamics"
  ],
  "hallmark_ids": [
    "deregulated_nutrient_sensing",
    "mitochondrial_dysfunction"
  ],
  "endpoint_category": "functional",
  "direction": "mixed",
  "evidence_tier": "human_function",
  "confidence": "moderate",
  "statement": "In older adults randomized during 12 weeks of aerobic exercise training, metformin attenuated exercise-induced gains in whole-body insulin sensitivity and VO2 max and abrogated the exercise-mediated increase in skeletal-muscle mitochondrial respiration, with variable positive and negative responder patterns.",
  "population_or_model": "Older adults undergoing aerobic exercise training",
  "time_horizon": "12 weeks",
  "quantitative_note": "The PubMed abstract reports placebo n=26 and metformin n=27.",
  "caveats": [
    "The trial tested adjunctive metformin during exercise, not metformin monotherapy.",
    "Exercise training improved several measures regardless of treatment, so the result is a context-specific interaction.",
    "The finding argues against broad preventive use without phenotype and co-intervention stratification."
  ],
  "tags": [
    "human",
    "metformin",
    "exercise",
    "mitochondrial-biogenesis-and-dynamics",
    "functional-boundary"
  ]
}
