{
  "schema_version": "1.0.0",
  "record_type": "finding",
  "id": "rvd1-improved-aged-muscle-functional-recovery",
  "name": "RvD1 improved aged mouse muscle functional recovery after injury",
  "summary": "Aged muscle showed deficient pro-resolving mediator biosynthesis after injury, and systemic RvD1 improved recovery of muscle-specific force while limiting fibrosis and inflammatory cytokine expression.",
  "source_id": "pmid-34075679",
  "study_id": "rvd1-aged-muscle-injury-regeneration",
  "intervention_ids": [
    "resolvin-d1"
  ],
  "track_ids": [
    "resolution-pathway-and-tissue-repair"
  ],
  "hallmark_ids": [
    "chronic_inflammation",
    "altered_intercellular_communication"
  ],
  "endpoint_category": "functional",
  "direction": "positive",
  "evidence_tier": "animal",
  "confidence": "moderate",
  "statement": "After skeletal-muscle injury, aged mice had deficient local SPM-pathway biosynthesis; daily systemic RvD1 suppressed inflammatory cytokine expression, limited fibrosis, and improved recovery of muscle-specific force, although it did not fully restore leukocyte recruitment or myofiber regeneration.",
  "population_or_model": "Aged female C57BL/6 mice with barium-chloride tibialis anterior injury",
  "time_horizon": "Short-term injury recovery after daily systemic RvD1 treatment",
  "quantitative_note": "The staged baseline treats this as animal functional support with explicit regeneration limits.",
  "caveats": [
    "The efficacy evidence is mouse-only.",
    "RvD1 improved force recovery and remodeling but did not fully rescue myofiber regeneration.",
    "The injury model does not establish broad healthy-aging or LEV-relevant benefit."
  ],
  "tags": [
    "animal",
    "resolvin-d1",
    "muscle-repair"
  ]
}
