{
  "schema_version": "1.0.0",
  "record_type": "finding",
  "id": "young-microbiota-extended-killifish-lifespan",
  "name": "Young microbiota extended killifish lifespan and delayed behavioral decline",
  "summary": "Young-donor gut microbiota transfer provides a vertebrate lifespan anchor for ecosystem replacement.",
  "source_id": "pmid-28826469",
  "study_id": "killifish-young-microbiota-lifespan",
  "intervention_ids": [
    "fecal-microbiota-transplantation"
  ],
  "track_ids": [
    "ecosystem-replacement"
  ],
  "hallmark_ids": [
    "dysbiosis"
  ],
  "endpoint_category": "lifespan",
  "direction": "positive",
  "evidence_tier": "mortality_or_lifespan",
  "confidence": "moderate",
  "statement": "In African turquoise killifish, recolonizing middle-aged individuals with gut bacteria from young donors extended lifespan, delayed behavioral decline, prevented age-associated microbial diversity loss, and maintained a young-like gut bacterial community.",
  "population_or_model": "Middle-aged African turquoise killifish",
  "time_horizon": "Post-recolonization lifespan and behavioral follow-up",
  "quantitative_note": "The PubMed abstract reports lifespan extension and delayed behavioral decline but does not provide numeric effect sizes.",
  "caveats": [
    "The model is a short-lived fish rather than a mammal or human.",
    "Recolonization after microbiota disruption is not equivalent to routine clinical FMT in older adults.",
    "The young-like bacterial genera identified in killifish are not a defined human therapeutic consortium."
  ],
  "tags": [
    "lifespan",
    "animal",
    "killifish",
    "young-donor-microbiota"
  ]
}
