{
  "schema_version": "1.0.0",
  "record_type": "finding",
  "id": "triim-human-epigenetic-age-decrease",
  "name": "TRIIM reported lower epigenetic age in an uncontrolled human pilot",
  "summary": "The TRIIM pilot is a notable human epigenetic-clock signal, but its uncontrolled, small, male-only design limits interpretation.",
  "source_id": "pmid-31496122",
  "study_id": "triim-human-epigenetic-aging-pilot",
  "intervention_ids": [
    "triim-regimen",
    "growth-hormone",
    "dhea",
    "metformin"
  ],
  "track_ids": [
    "dna-methylation-and-epigenome-restoration"
  ],
  "hallmark_ids": [
    "epigenetic_alterations"
  ],
  "endpoint_category": "biomarker",
  "direction": "positive",
  "evidence_tier": "human_biomarker",
  "confidence": "low",
  "statement": "In nine healthy men, one year of the TRIIM thymus-regeneration regimen was associated with lower DNA-methylation epigenetic age and immunosenescence-marker movement.",
  "population_or_model": "Healthy men aged 51 to 65 years",
  "time_horizon": "One year of treatment plus reported six-month follow-up for GrimAge persistence",
  "quantitative_note": "The abstract reports mean epigenetic age about 1.5 years below baseline after one year and a -2.5-year change compared with no treatment at study end.",
  "caveats": [
    "The study was uncontrolled and included only nine men.",
    "The regimen combined growth hormone, DHEA, metformin, vitamin D, and zinc, so the active component is unclear.",
    "Several authors had Intervene Immune equity, roles, or related patent interests.",
    "The result is a biomarker signal, not evidence of durable functional, disease, or mortality benefit."
  ],
  "tags": [
    "human",
    "pilot",
    "epigenetic-clock",
    "uncontrolled"
  ]
}
