{
  "schema_version": "1.0.0",
  "record_type": "finding",
  "id": "aged-mice-resolution-deficit-rescued-by-nano-proresolving-medicines",
  "name": "Aged mice showed delayed resolution rescued by nano-proresolving medicines",
  "summary": "Aged mice had delayed acute-inflammation resolution and reduced SPMs; DHA and aspirin-triggered resolvin nano-proresolving medicines activated resolution pathways.",
  "source_id": "pmid-25217168",
  "study_id": "aged-resolution-nano-proresolving-medicines",
  "intervention_ids": [
    "resolvin-d1"
  ],
  "track_ids": [
    "resolution-pathway-and-tissue-repair"
  ],
  "hallmark_ids": [
    "chronic_inflammation",
    "altered_intercellular_communication"
  ],
  "endpoint_category": "mechanistic",
  "direction": "positive",
  "evidence_tier": "animal",
  "confidence": "moderate",
  "statement": "In aged mice, acute inflammation resolution was delayed and SPMs were reduced; DHA accelerated resolution through increased SPMs, while nano-proresolving medicines carrying aspirin-triggered resolvins reduced inflammation by promoting efferocytosis.",
  "population_or_model": "Aged mice in self-resolving zymosan peritonitis, with human monocyte mechanistic assays",
  "time_horizon": "Acute inflammation-resolution time course",
  "quantitative_note": "The finding supports an aging-linked resolution deficit and pharmacologic resolution activation, not human tissue-repair efficacy.",
  "caveats": [
    "The in vivo efficacy evidence is animal-level.",
    "Peritonitis resolution is not the same as durable tissue repair or regeneration.",
    "The nano-proresolving medicine delivery approach is experimental."
  ],
  "tags": [
    "animal",
    "resolution",
    "spm"
  ]
}
